<?xml version="1.0" encoding="ISO-8859-1"?>
<Configuration xmlns:xsi="http://www.w3.org/2001/XMLSchema-instance" xsi:noNamespaceSchemaLocation="cmconfiguration.xsd">
    <ApplicationAbsoluteRootPath>/usr/local/data/cm</ApplicationAbsoluteRootPath>

    <SoftwareDownload>
        <DLU>
            <Name>0000-mcg_videostrm_nrt2ppc</Name>
            <Versioning>Strict</Versioning>
            <SoftwareVersion>
                <Version>1</Version>
                <Release>1</Release>
                <Update>2</Update>
                <Evolution>0</Evolution>
            </SoftwareVersion>
        </DLU>        

    </SoftwareDownload>

    <ComponentManagerScheduling>

        <AsynchronousACOInstance>
            <Name>VideoStreaming</Name>
            <ThreadPriority>3</ThreadPriority>
            <IsInitiallyActive>TRUE</IsInitiallyActive>
        </AsynchronousACOInstance>

    </ComponentManagerScheduling>

</Configuration>
